<?xml version="1.0" encoding="UTF-8"?>
<!DOCTYPE aaf-file SYSTEM "EPDerivationChain.dtd">
<aaf-file>
<!-- Test one incorrect audio edit rate -->
 <clip name="Clip 1">
  <timeline-mob-slot edit-rate-denominator="24" edit-rate-numerator="600">
   <source-clip length="0" track-type="audio">
    <file-source name="File Source 1" sample-rate-denominator="24" sample-rate-numerator="600">
     <timeline-mob-slot edit-rate-denominator="1" edit-rate-numerator="1">
      <eoc length="0" track-type="none"/>
     </timeline-mob-slot>
    </file-source>
   </source-clip>
  </timeline-mob-slot>
 </clip>
 <clip name="Clip 2">
  <timeline-mob-slot edit-rate-denominator="24" edit-rate-numerator="1200000">
   <source-clip length="0" track-type="audio">
    <file-source name="File Source 1" sample-rate-denominator="24" sample-rate-numerator="600">
     <timeline-mob-slot edit-rate-denominator="1" edit-rate-numerator="1">
      <eoc length="0" track-type="none"/>
     </timeline-mob-slot>
    </file-source>
   </source-clip>
  </timeline-mob-slot>
 </clip>
</aaf-file>
